{
  "agent_id": "agt_general",
  "uri": "nexus://agent/agt_general",
  "tenancy": {
    "enterprise_id": "nexus",
    "tenant_id": "platform"
  },
  "name": "General",
  "purpose": "Everyday knowledge work in the Project",
  "status": "published",
  "version": 4,
  "instructions": "",
  "created_by": "nexus-platform",
  "created_at": "2026-09-17T00:00:00Z",
  "published_at": "2026-09-17T00:00:00Z",
  "skill_refs": [
    "nexus://skill/skl_summarize_sources",
    "nexus://skill/skl_extract_structured_data",
    "nexus://skill/skl_classify_sensitivity",
    "nexus://skill/skl_answer_from_sources",
    "nexus://skill/skl_compare_documents",
    "nexus://skill/skl_draft_and_rewrite",
    "nexus://skill/skl_translate",
    "nexus://skill/skl_meeting_notes_to_actions",
    "nexus://skill/skl_create_flow",
    "nexus://skill/skl_pin_context",
    "nexus://skill/skl_mail_triage"
  ],
  "inference": {
    "role": "reasoner",
    "strategy": "quality_first"
  },
  "permissions": {
    "max_classification": "secret"
  },
  "governance": {
    "state": "approved",
    "reviewed_at": "2026-09-17T00:00:00Z"
  },
  "capability": {
    "intents": [
      "explain",
      "summarize",
      "draft_document",
      "translate",
      "plan",
      "report"
    ],
    "domains": [
      "general"
    ],
    "inputs": [
      "text",
      "attachment",
      "url"
    ],
    "outputs": [
      "text",
      "document"
    ],
    "side_effects": false,
    "background_supported": false,
    "cost_class": "medium",
    "latency_class": "interactive",
    "classification_max": "secret"
  }
}
